{
  "schemaVersion": "1.0",
  "fileId": "10000000-0000-4000-8000-000000000001",
  "tenantRef": "8e4aa79b0e4e8c2f",
  "version": 1,
  "displayName": "informe-lote.pdf",
  "declaredMediaType": "application/pdf",
  "detectedMediaType": "application/pdf",
  "sizeBytes": 47,
  "sha256": "2d711642b726b04401627ca9fbac32f5da7e5c8530fb1903cc4db02258717921",
  "state": "available",
  "classification": "confidential",
  "linkedResource": { "type": "management_unit", "id": "20000000-0000-4000-8000-000000000001" },
  "legalHold": false,
  "createdAt": "2026-08-05T12:00:00Z"
}
